{
  "schema_version": "1.0.0",
  "project": "The Architect’s Journey + The Twelve Zodiac Adventures",
  "status": "planning_not_produced",
  "language": "en",
  "learner_support_language": "vi",
  "core_count": 12,
  "expansion_count": 60,
  "vocabulary_target_unique_lemmas": 3000,
  "lessons": [
    {
      "id": "C01",
      "type": "core",
      "title": "A Question at Sunrise",
      "topic": "family, daily routines, identity",
      "target_new_words": 250,
      "word_ids": [],
      "target_audio_minutes": {
        "preferred": 30,
        "maximum": 45
      },
      "sections": [
        {
          "id": "main_story",
          "name": "Main Story"
        },
        {
          "id": "word_discovery",
          "name": "Word Discovery"
        },
        {
          "id": "quick_response",
          "name": "Quick Response"
        },
        {
          "id": "time_shift",
          "name": "Time Shift"
        }
      ],
      "status": "outline_only"
    },
    {
      "id": "C02",
      "type": "core",
      "title": "The House That Listened",
      "topic": "home, objects, feelings",
      "target_new_words": 250,
      "word_ids": [],
      "target_audio_minutes": {
        "preferred": 30,
        "maximum": 45
      },
      "sections": [
        {
          "id": "main_story",
          "name": "Main Story"
        },
        {
          "id": "word_discovery",
          "name": "Word Discovery"
        },
        {
          "id": "quick_response",
          "name": "Quick Response"
        },
        {
          "id": "time_shift",
          "name": "Time Shift"
        }
      ],
      "status": "outline_only"
    },
    {
      "id": "C03",
      "type": "core",
      "title": "The Missing Drawing",
      "topic": "work, time, communication",
      "target_new_words": 250,
      "word_ids": [],
      "target_audio_minutes": {
        "preferred": 30,
        "maximum": 45
      },
      "sections": [
        {
          "id": "main_story",
          "name": "Main Story"
        },
        {
          "id": "word_discovery",
          "name": "Word Discovery"
        },
        {
          "id": "quick_response",
          "name": "Quick Response"
        },
        {
          "id": "time_shift",
          "name": "Time Shift"
        }
      ],
      "status": "outline_only"
    },
    {
      "id": "C04",
      "type": "core",
      "title": "A Village Without Walls",
      "topic": "community, relationships, places",
      "target_new_words": 250,
      "word_ids": [],
      "target_audio_minutes": {
        "preferred": 30,
        "maximum": 45
      },
      "sections": [
        {
          "id": "main_story",
          "name": "Main Story"
        },
        {
          "id": "word_discovery",
          "name": "Word Discovery"
        },
        {
          "id": "quick_response",
          "name": "Quick Response"
        },
        {
          "id": "time_shift",
          "name": "Time Shift"
        }
      ],
      "status": "outline_only"
    },
    {
      "id": "C05",
      "type": "core",
      "title": "The Garden in the Sky",
      "topic": "nature, health, environment",
      "target_new_words": 250,
      "word_ids": [],
      "target_audio_minutes": {
        "preferred": 30,
        "maximum": 45
      },
      "sections": [
        {
          "id": "main_story",
          "name": "Main Story"
        },
        {
          "id": "word_discovery",
          "name": "Word Discovery"
        },
        {
          "id": "quick_response",
          "name": "Quick Response"
        },
        {
          "id": "time_shift",
          "name": "Time Shift"
        }
      ],
      "status": "outline_only"
    },
    {
      "id": "C06",
      "type": "core",
      "title": "The Man Who Built Nothing",
      "topic": "skills, learning, choices",
      "target_new_words": 250,
      "word_ids": [],
      "target_audio_minutes": {
        "preferred": 30,
        "maximum": 45
      },
      "sections": [
        {
          "id": "main_story",
          "name": "Main Story"
        },
        {
          "id": "word_discovery",
          "name": "Word Discovery"
        },
        {
          "id": "quick_response",
          "name": "Quick Response"
        },
        {
          "id": "time_shift",
          "name": "Time Shift"
        }
      ],
      "status": "outline_only"
    },
    {
      "id": "C07",
      "type": "core",
      "title": "The Journey Beyond the Mountains",
      "topic": "travel, directions, experiences",
      "target_new_words": 250,
      "word_ids": [],
      "target_audio_minutes": {
        "preferred": 30,
        "maximum": 45
      },
      "sections": [
        {
          "id": "main_story",
          "name": "Main Story"
        },
        {
          "id": "word_discovery",
          "name": "Word Discovery"
        },
        {
          "id": "quick_response",
          "name": "Quick Response"
        },
        {
          "id": "time_shift",
          "name": "Time Shift"
        }
      ],
      "status": "outline_only"
    },
    {
      "id": "C08",
      "type": "core",
      "title": "The City That Never Slept",
      "topic": "technology, business, decisions",
      "target_new_words": 250,
      "word_ids": [],
      "target_audio_minutes": {
        "preferred": 30,
        "maximum": 45
      },
      "sections": [
        {
          "id": "main_story",
          "name": "Main Story"
        },
        {
          "id": "word_discovery",
          "name": "Word Discovery"
        },
        {
          "id": "quick_response",
          "name": "Quick Response"
        },
        {
          "id": "time_shift",
          "name": "Time Shift"
        }
      ],
      "status": "outline_only"
    },
    {
      "id": "C09",
      "type": "core",
      "title": "When Everything Went Wrong",
      "topic": "problems, causes, solutions",
      "target_new_words": 250,
      "word_ids": [],
      "target_audio_minutes": {
        "preferred": 30,
        "maximum": 45
      },
      "sections": [
        {
          "id": "main_story",
          "name": "Main Story"
        },
        {
          "id": "word_discovery",
          "name": "Word Discovery"
        },
        {
          "id": "quick_response",
          "name": "Quick Response"
        },
        {
          "id": "time_shift",
          "name": "Time Shift"
        }
      ],
      "status": "outline_only"
    },
    {
      "id": "C10",
      "type": "core",
      "title": "The Smallest House in the World",
      "topic": "comparisons, size, needs",
      "target_new_words": 250,
      "word_ids": [],
      "target_audio_minutes": {
        "preferred": 30,
        "maximum": 45
      },
      "sections": [
        {
          "id": "main_story",
          "name": "Main Story"
        },
        {
          "id": "word_discovery",
          "name": "Word Discovery"
        },
        {
          "id": "quick_response",
          "name": "Quick Response"
        },
        {
          "id": "time_shift",
          "name": "Time Shift"
        }
      ],
      "status": "outline_only"
    },
    {
      "id": "C11",
      "type": "core",
      "title": "A Gift for the Future",
      "topic": "hope, teamwork, responsibility",
      "target_new_words": 250,
      "word_ids": [],
      "target_audio_minutes": {
        "preferred": 30,
        "maximum": 45
      },
      "sections": [
        {
          "id": "main_story",
          "name": "Main Story"
        },
        {
          "id": "word_discovery",
          "name": "Word Discovery"
        },
        {
          "id": "quick_response",
          "name": "Quick Response"
        },
        {
          "id": "time_shift",
          "name": "Time Shift"
        }
      ],
      "status": "outline_only"
    },
    {
      "id": "C12",
      "type": "core",
      "title": "The House of Tomorrow",
      "topic": "future, dreams, cumulative review",
      "target_new_words": 250,
      "word_ids": [],
      "target_audio_minutes": {
        "preferred": 30,
        "maximum": 45
      },
      "sections": [
        {
          "id": "main_story",
          "name": "Main Story"
        },
        {
          "id": "word_discovery",
          "name": "Word Discovery"
        },
        {
          "id": "quick_response",
          "name": "Quick Response"
        },
        {
          "id": "time_shift",
          "name": "Time Shift"
        }
      ],
      "status": "outline_only"
    },
    {
      "id": "Z01",
      "type": "optional_expansion",
      "title": "The Mouse Who Wanted to Fly",
      "zodiac": {
        "vietnamese_slug": "Ty",
        "animal": "Mouse",
        "series": "The Curious Mouse"
      },
      "aligned_core_lesson": "C01",
      "target_audio_minutes": 15,
      "sections": [
        {
          "id": "daily_adventure",
          "name": "Daily Adventure"
        },
        {
          "id": "quick_response",
          "name": "Quick Response"
        }
      ],
      "status": "outline_only",
      "independently_comprehensible": true
    },
    {
      "id": "Z02",
      "type": "optional_expansion",
      "title": "A Very Strange Breakfast",
      "zodiac": {
        "vietnamese_slug": "Ty",
        "animal": "Mouse",
        "series": "The Curious Mouse"
      },
      "aligned_core_lesson": "C01",
      "target_audio_minutes": 15,
      "sections": [
        {
          "id": "daily_adventure",
          "name": "Daily Adventure"
        },
        {
          "id": "quick_response",
          "name": "Quick Response"
        }
      ],
      "status": "outline_only",
      "independently_comprehensible": true
    },
    {
      "id": "Z03",
      "type": "optional_expansion",
      "title": "The Giant’s Little Shoes",
      "zodiac": {
        "vietnamese_slug": "Ty",
        "animal": "Mouse",
        "series": "The Curious Mouse"
      },